428492528631812096	ang pang ra rape ni vhong ay prang minute win sya pumasok tapos sya binugbog ni cedric	?
428492757317869568	rt real rape victims suffering trauma uncomfortable deniece rape victim well feeling fresh no emotion	?
428501507164495872	female politician suggests indian women invited rape new delhi reuters indian female politician	?
428504172556595200	dumating si vhong dumating si deniece dumating si cendric ano yun rape minute ano	?
428509679509979137	girl beaten unconscious classmates md elementary scho dc news fox dc wttg _url_ smdh	?
428510290666201088	rt dumating si vhong lumabas si deniece dumating si cedric less mins ni rape agad ano	?
428524673450512384	not surprising reminds old blog post _url_ ncp woman politician suggests nirbhaya invited rape	?
428525231318110208	wolverines kicker brendan gibbons expelled michigan amid sexual assault investigation _url_	?
428539775205646336	rt lady group pulled kapil sharma joke pregnant women feels rape woman fault	?
428548405552373760	yes re open every case starting hitler genocide delhi rape idiot reopen	?
428549859579527168	id consider rape	?
428554031573659648	rivera sadly child welfare agencies virtually silent child sex trafficking dmst	?
428559672891543552	picked stick ground knocked fat girl never spoke another word beat	?
428561206580764672	rt dumating si vhong lumabas si deniece dumating si cedric less mins ni rape agad ano	?
428562128795336704	ave rape festival practises sister friends basedmuzi raping siblings tradition	?
428563038409461761	child rape blackmail scum state _url_	?
428564909497274368	well rape failedthatfinal	?
428570911802142721	court remands man alleged rape nigeria _url_	?
428571654243889152	rt blah blah abortion rape genocide homicide suicide pedophilia midget unicorn shit piss fuck bukakke racial slu	?
428591827571474432	rt first scene jaws girl attacked screaming real pain harness broke hip dragged	?
428592397115617280	rt first scene jaws girl attacked screaming real pain harness broke hip dragged	?
428592715664588800	change new delhi year old raped boyfriend pretext marriage _url_ crime rape vaw india via	?
428595044870651904	rt first scene jaws girl attacked screaming real pain harness broke hip dragged	?
428598163268579328	deniececornejo ayaw mo paawat ano yan minute ro rape _url_	?
428601101039194112	think can done rape problem college campuses will help _url_	?
428604985798959104	rt woman fire burn wake replaced pints whiskey cigarettes outer space	?
428610191873957889	buy cuz m girl burn girls	?
428615664513728512	rt ancient rome men found guilty rape testicles crushed two stones	?
428631576927166464	inspired dumb things people said sex rape india _url_ us _url_	?
428649305290076160	female cop sued allgedly arrests scolds woman rape _url_	?
428652586271404032	m intentionally talking waseda university faculty guy attacked argumentative said comfort women system wrong	?
428661464417583104	police arrest robbery rape ogun _url_	?
428661631397404673	rt homie wanna rape battle say bruh rape battle homie rape battle	?
428663409656094721	isn non consensual sex pc way saying rape take one occurrence versus two	?
428663750175252480	isangguni kay attorney sa isyu ng rape panggagahasa kasama si atty emmanuel joseph cera legal _url_	?
428669892410093569	elephants kill people every year known also rape kill grown rhinos	?
428682250318643200	fuckkk finna get attacked oprah twitter ain rape moan	?
428685700964184064	lifewire making difference domestic violence leading cause homelessness women children _url_	?
428686920822968321	bible speaks talking serpents donkeys earth flat condones slavery allows rape etc book wrong	?
428689511334547456	girl shake booty beat soulja boy thang come hang wit throwback	?
428690253495283712	two rape ll record	?
428691895431471104	minute rape hahahahahagaga _url_	?
428693411109928960	nung una attempted rape pangalawa ni rape na pangatlo ano nambugbog si vhong ng anim na lalake	?
428695924831830016	niggas still tryna rape females now _url_	?
428695981748940800	rt please don allow violent hatemongers use app harass exploit marginalized women _url_	?
428750901588033536	hoes scared touch em gone yell rape	?
428763073906606081	m still marriage children though lmaoo nunna	?
428769876799262721	m sure get ass whooped court many women basketball players alltalk way burn nat	?
428785737685676032	time although physically rape just filling hole also isn something else _url_	?
428797240304353280	stockman called violence women act truly bad bill benefit men dressed women _url_	?
428800237491068928	myredbook doctor_t can rape pay paid heels room outfit write libel internet	?
428802383536480256	ani ode ni se sis hope don mean rape sha official lost c	?
428830146989420544	can rape andy sos una desmadre	?
428839791954644992	oa mo na denise pavictim ipagang rape na yan si gaga hahah	?
428841420460285952	di ka kailangan rape ni vhong deniece kasi sinong babae tutuwad diyan amen hahahaahh	?
428843125935595520	rape deniece cornejo rape hahahaha _url_	?
428847215524585472	less minutes rape agad minute win ahahaha	?
428850399085600768	sochi worker tells brutal rape newslocker _url_	?
428865137496576000	man served prison sentence years rape murder later found wrongly convicted diked ting	?
428876401039929344	asked week talking asked hand marriage god forced outta feel love idea	?
428888349584424960	super bowl sex trafficking _url_	?
428894146598690817	except kills humans rape woman	?
428895696281169920	please rt follow help support stop domestic sexual violence itsnotalwaysphysical	?
428896572466683904	beltway insider obama preps state union us russia talk olympic security wh sexual assault task force _url_	?
428905491226312704	justice lose justice rape justice gone	?
428911614033551361	rape bailable offense	?
428913376048074753	civ test clark gonna rape sideways easy peasy can	?
428924810131808256	transgender women color almost times likely experience police violence general trans population	?
428944210658885632	rt rape women hate women think time kill women time heal women rea	?
428961359133691904	tickling just rape slightly eye contact necessary	?
428968792602206208	super bowl sex trafficking myths _url_	?
428970931403231232	woman alleges abduction sexual assault lapd video side video _url_ via	?
428985856292962306	dream last night forced marriage didn want ran forest japan	?
429000036652171264	strange turn story beaten gay journalist kicked woman prior incident complaint says ny _url_	?
429004844427657216	just fb stalking women fake babies severely freaked now bitchesbecrazy	?
429021699430809600	girl got beaten death photo bombing	?
429026056264101889	evan peters omg going rape wearing leather body suit _url_ harry styles	?
429028173385179137	absolutely appalling rape survivors drc punished rape please read _url_	?
429031429624700928	kind culture msnbc allowing hate racism calls violence women occur culture culture culture	?
429037613543358464	hipster girl burn mouth pizza wanted eat cool	?
429045481256128512	police culture disbelief rape claims alarms official monitoring group new figures reveal polic _url_	?
429048625637773312	rt rape college campus especially among black students still not given proper attention needs	?
429063481044660224	rt white ppl get away wearing single layers weather murder rape dui drug chargers slavery clearly	?
429067630603796480	said rape happens reason no	?
429067816470593536	ss rape boo rt ready fa another day _url_	?
429073655105355776	rt s rpt violence indigenous women canada published year ago need action now _url_	?
429075093294440449	rape jojojo xd ah re papa nuel lo dude banda pero mi cu ayudo terminar de decidirme	?
429087880988729345	will rape	?
429095028032434176	grow want son first daughter son beat boy makes little girl cry	?
429103575613325313	spongebob makes anal rape joke _url_	?
429103809189527552	hate rape sexual assault apart people lives especially childhood makes angry sad	?
429110911152840705	like rape tons demented shit principle yes	?
429114431495086080	girl carpet burn shoulders bruises everywhere	?
429149577338699776	newcomer opens rape mother suffered song wrote _url_	?
429168861158461440	rt ex asking could visit bring pizza pwede kaya akong sumigaw ng rape chos	?
429169200624828416	yes real men don rape stoprapenow	?
429204147280150528	may bago daw game show ngayon minute rape join na sa condo daw ang audition	?
429224967679787008	rt many music institutions rape artists name providing platform	?
429230863381852161	trying rape pancho bathroom isn	?
429231321143967745	wahhh many houses today dont guilty just rape asked	?
429238179405651968	regards uk home office statistics rape rape crime judged attrition rate	?
429247711939141632	course young asain men think violence women disagree men accepted look bringing parents	?
429250408461373440	ll rape date open place not sure whether re rapist nah brings along friend	?
429263323943948288	tweet think reconsider selling book seems encourage rape _url_	?
429278914129567744	dr michelle ward inspiring women ever stalking ain no joke people think funny	?
429281249392590848	glad detention tday bc waitin outside room idk girl punched another girl eye kicked	?
429287422367903744	mean phenomenon survivors bootstrap theories rape without research	?
429288416086208512	rt aids just yell words someone tries rape re welcome	?
429291923745304577	rt data rape allegations classified no crime police forces england wales _url_ _url_	?
429293559015956481	man trial rape refusing wear condom sex _url_	?
429303036825968640	rt child marriage dowry sati part tradition aap spokesperson times now	?
429304888212733952	sorcar granddaughter working violence towards women mumtaz sorcar daughter pc sorcar jr gra _url_	?
429323445466574848	melvin allen found not guilty friday counts rape count gross sexual imposition burglar _url_	?
429332221132955648	melvin allen found not guilty friday counts rape count gross sexual imposition burglar _url_	?
429337869010743297	super bowl sex trafficking real just rumour _url_	?
429337944042651648	re lucky didn rape	?
429349367066411009	study justify don justify lesbianism rape reason women choose never man	?
429378576371425280	looking bit brighter paris days ibiza august events mean time bout rape ass fifa	?
429388755531608065	guess one way rape prevention _url_	?
429391074751037440	kirsten gillibrand slams sexual assault panel decision commander role senator questions sexual	?
429427674776227840	end epidemic rape military fixing broken justice system _url_	?
429429921962672128	spongebob makes anal rape joke _url_	?
429435687075454976	rt questionsforamnesty call pimping trafficking slavery violence abuse women kids http	?
429436648435097600	newcomer opens rape mother suffered song wrote _url_	?
429456347072319488	reasonsineedfeminism rape statistics _url_	?
429478687612747776	due process getting child marriage way boy major	?
429481159601311744	cutting grass no punishment rape hold rapists police account kenya can set example world justiceforliz	?
429484916863012866	rt aap now khap just win haryana aap wants support khap aap reply women empowerment rape	?
429507406629208064	rt fran ois xavier nsanzuwera stresses importance giving voice victims prosecuting sexual violence crime	?
429513145359429632	court remands yr old man rape year old girl _url_	?
429555007197679616	end epidemic rape military fixing broken justice system _url_	?
429555388451921922	colleges accused mishandling sexual assault cases _url_	?
429565022390718464	last week someone threatened rape story obviously something else found strange wake	?
429595536241348609	phone supposed come doesn ima hunt delivery man rape kill	?
429605351457976320	rt indonesian woman falls victim human trafficking us opinion _url_ _url_	?
429613810035736576	almost yrs later nothing changed anti rape protests delhi _url_	?
429643239348379648	rt making child marriage binding adults married minors will cruel moral policing de	?
429650344407482368	rt ll rape rt stokecity yamasimba friendsofstokecity	?
429650397826142208	rt imam says non hijab wearing women asking raped tries rape one worldhijabday allaboutrape _url_	?
429655591758618624	retweet think sould punishment rape _url_	?
429655809316765697	rt average female prostitut begins turning tricks years age documentary rape profit	?
429662898437095424	former white house lawyer now working bikram yoga guru accused rape _url_	?
429664313255542784	trafficking humantrafficking isn just kids isn just women isn just sex _url_	?
429665220856795136	rt dark end street black women rape resistance _url_ blackfemstory	?
429682115672678400	fuck white girls gone eat yo ass don get mad holler rape nigga hating dad	?
429685504116662272	join super bowl prayer party not praying teams souls sex trafficking homes churches _url_	?
429710008306388992	austrian woman raped dubai told options marry attacker jailed _url_ rape	?
429713929691213826	report week suggests trend disturbing postcode lottery rape victims emerging _url_	?
429714439797870592	jean pascal jean pascal boxing champion jean pascal contacted investigator alleged sexual assault _url_	?
429727836434604032	_url_ alsof het iemand anders rape butnotrealy likingit	?
429734512273022977	rt dylan farrow woody allen living testament way society fails survivors sexual assault _url_	?
429736710037966848	wonder sometimes accuse guy rape ruin life screed just next way silence victims	?
429760579423580160	rt trigger warning incest sexual assault abus dylan farrow survivng sexual assault father woody allen htt	?
429764337302241280	tw sexual assault child mt dylan farrow writes sexually abused woody allen _url_	?
429770527662964736	watching ppl support ur abuser something survivors experience farrow letter condemnation rape culture	?
429782567672610816	don take seriously rape accusation re probably asshole mean no reason not thatisall	?
429789778310332418	rt woody allen living testament way society fails survivors sexual assault abuse _url_	?
429804330292879362	think _url_ boarding rape	?
429805708851572738	want give shout suxc alum kyle heath face timing birthday girl could watch cuse beat dook tcb	?
429811728717971456	rt patriarchyis sexual violence can not separated presence extraction industry man	?
429815317699653632	unfortunately current incarnation due process sa survivors rape kits re traumatizing massive backlogs	?
429849121231343616	isn no data actually support notion increased sex trafficking accompanies super bowl _url_	?
429863219113762816	rape little girls people stop wanting movies people also stop paying see	?
429866823341723648	rt type evidence people demand like sexual violence crime ridiculous c often doesn exist belie	?
429902391631048705	limousine sublease sydney outhouse happen reliable forced marriage buggy furtherance self oegm	?
429903646785294336	rt imam says non hijab wearing women asking raped tries rape one worldhijabday allaboutrape _url_	?
429907290490011648	minute win pala ang pagkaka rape ka deniece slow claps	?
429910172610207744	rape insane di sana natroma ka na matagal ka nang umiyak sa tv nice	?
429917301253492736	rt deniece na rape ako sa isang minuto	?
429958170732425216	lawmaker nfl must combat sex trafficking _url_	?
429958701139910656	rape _url_	?
429974765890437120	rt first girl attacked movie jaws screaming real pain harness broke hip dragged	?
429975990186831872	rt first girl attacked movie jaws screaming real pain harness broke hip dragged	?
429982370863661057	super bowl sunday women victims domestic violence record numbers dark side men change day stop	?
429989677069008896	sex prostitute without permission rape shoplifting	?
429995334560133120	rt first girl attacked movie jaws screaming real pain harness broke hip dragged	?
430008415138893824	esports kay girl wasnt one got kicked	?
430019009216790529	remembering precious girls loured sex trafficking super bowl year ago _url_	?
430020404514521089	sound blame rape victim _url_	?
430022173106110464	rt ibelievedylanfarrow false allegations astronomically rare false denials sexual violence terrifyingly	?
430039232267440128	new black mob violence rape not sure one got _url_	?
430055009309315072	body beat fuck dominate mutilate strangulate rape bugger kill eat right kill	?
430055353083256832	whoever blowing rape whistle needs go like now	?
430097150375366656	piece excrement unprofessional journalist incapable objectivity rape denier apologist	?
430101127481135104	crmbl another one crazy department saudi cleric calls babies wear burqas prevent rape _url_	?
430103363792154624	mt superbowl sextrafficker playground _url_ trafficking women justice htchallenge not sale	?
430104301814706177	stalk nightmares rape dreams	?
430111326145236992	meaning people myredbook private molester rape women forums probably created forums erosescort dot tumblr	?
430120876953321472	mcdonald imitates rape hotline ads sell big macs notbuyingit _url_	?
430125909019222016	still happened like chevrolet much like mechanical rape now lookitup factoryfarms	?
430126050098839552	rt wait awkward rape commercial seriously notbuyingit	?
430131501989367808	m either brothers men will rape better run bitch run bitch run _url_	?
430133718108221440	rt sex trafficking happens every day right community time go offensive _url_ notsosuper	?
430139558655578113	pretty sure every female america hormones just kicked overdrive david beckham	?
430148272230260736	rt just think could performing super bowl halftime hadn kicked girl	?
430151056807309313	rt chris brown needs perform next yearhe might just beat female dancers	?
430153278186221568	will rape bruno mars	?
430154961096175616	rape bruh	?
430155604955791360	don try uploading game pornhub don allow rape	?
430155615257001985	don try uploading game pornhub don allow rape	?
430156004668735488	don try uploading game pornhub don allow rape oh shit	?
430156363436929025	need air christ don try uploading game pornhub don allow rape	?
430156389764177920	rd_ x______x don try uploading game pornhub don allow rape	?
430156422337540096	rape _url_	?
430156551920173056	don try uploading game pornhub don allow rape	?
430156726772699136	wild flagrant don try uploading game pornhub don allow rape	?
430157363509612544	don try uploading game pornhub don allow rape	?
430157793325105152	don try uploading game pornhub don allow rape	?
430157922799079426	don try uploading game pornhub don allow rape	?
430158805088108544	don try uploading game pornhub don allow rape	?
430159480978808832	rape session right now	?
430159535840694272	don try uploading game pornhub don allow rape	?
430159725037387777	rape embarrassment	?
430159773242126336	just became rape case	?
430159848152371204	don try uploading game pornhub don allow rape	?
430159882940334080	don try uploading game pornhub don allow rape	?
430159972174163968	not not even game rape	?
430159983032795136	rt hey fuck don try uploading game pornhub don allow rape	?
430160088255692800	don try uploading game pornhub don allow rape	?
430160179930214400	loool don try uploading game pornhub don allow rape	?
430160213648637953	don try uploading game pornhub don allow rape	?
430160219386023937	children age close eyes statutory rape superbowl	?
430160444452773888	don try uploading game pornhub don allow rape	?
430160623914074112	fcc regulations changed didn know could broadcast rape without penalty superbowl gohawks	?
430160839820447745	don try uploading game pornhub don allow rape	?
430160864725827586	don try uploading game pornhub don allow rape	?
430160869809344513	rt breaking new jersey police filed murder assault rape charges seahawks re	?
430160889942007808	rt isn football rape	?
430161089977143296	don try uploading game pornhub don allow rape m	?
430161180691537920	don try uploading game pornhub don allow rape	?
430161212241113088	don try uploading game pornhub don allow rape	?
430161336022994944	don try uploading game pornhub don allow rape	?
430161413341208576	don try uploading game pornhub don allow rape	?
430161685064585219	rt breaking new jersey police filed murder assault rape charges seahawks re	?
430161737032007681	don try uploading game pornhub don allow rape	?
430161752362205184	don try uploading game pornhub don allow rape	?
430161827637780480	don try uploading game pornhub don allow rape	?
430161870851690496	don try uploading game pornhub don allow rape	?
430162178906542080	don try uploading game pornhub don allow rape	?
430162329221611521	don try uploading game pornhub don allow rape	?
430162458850779136	don try uploading game pornhub don allow rape lmao	?
430163082074411008	rape no vasaline	?
430163808381046784	rt breaking new jersey police filed murder assault rape charges seahawks re	?
430164102573723648	jajajajaja don try uploading game pornhub don allow rape	?
430164450822205440	dont even watch football rape somebody got paid yeah defly don watch	?
430164714715234304	don try uploading game pornhub don allow rape el tweet del super bowl	?
430165233106444288	don try uploading game pornhub don allow rape	?
430165383035621377	don try uploading game pornhub don allow rape	?
430165440497598464	don try uploading game pornhub don allow rape	?
430166484040425472	don try uploading game pornhub don allow rape	?
430167204429316096	don try uploading game pornhub don allow rape	?
430167695896498176	don try uploading game pornhub don allow rape	?
430168212756762624	don try uploading game pornhub don allow rape	?
430168833622835200	don try uploading game pornhub don allow rape	?
430169519882264576	rp breaking news entire roster arrested charged rape st degree	?
430170388241207296	don try uploading game pornhub don allow rape	?
430170882548727809	don try uploading game pornhub don allow rape	?
430171001914023936	don try uploading game pornhub don allow rape	?
430173993656537089	delhi manipur women assaulted beaten men arrested _url_	?
430174652019666944	don try uploading game pornhub don allow rape	?
430178814589546496	don try uploading game pornhub don allow rape	?
430180787296555008	go ahead admit faggot shit tighter butt rape	?
430182057507958784	don try uploading game pornhub don allow rape no chill	?
430183916041822209	blog just like saying jwinston didn rape girl wasn charged	?
430184719850819584	rape dumb rape innocent person hoes fucking free	?
430185334689640448	late fault gang raped says indian politician asha mirje _url_ rapeculture rape waronwomen	?
430201035550777344	girl left baby doll lying middle yard noodles gets dressed dragged along tossed car favorite guy	?
430202648009003008	mean gon get beat fucc trynna defend female weird nigga	?
430217882572947456	slavery africa ghana domesticviolence abuse _url_ notes gang rape illegal _url_	?
430245153123880960	don try uploading game pornhub don allow rape	?
430254946211360768	living days sons attempt rape mothers jesus coming back soon	?
430291901015916544	don try uploading game pornhub don allow rape	?
430303680521187328	rt prison rapes included rape statistics men raped women united states	?
430319512332681216	rape rape friend xd jajaja que mona por dios	?
430332596388495361	bakit ba pinagpipilitan nitong deniece na na rape sya push mo yang minute rape sayo pwe	?
430343363217592320	girl said way rape justin picture ummmmmm can not rape jb thx	?
430344849104318464	myth violence women rises super bowl	?
430362392447709184	rt women human rights organization rape cases registered islamabad last five years not one conviction _url_	?
430373794834677761	left lyrics blurred lines right rape victims quoting rapists said htt	?
430378870593032193	rape jokes not jokes woman hating jokes not jokes guys telling _url_	?
430380892242980864	calm everyone wasn legitimate rape	?
430381405332598784	reports sexual assault rose across largest campuses around boston _url_	?
430382648733626368	one fact overlooked use rape weapon syria	?
430383005870211072	may kinakatakutan kase tyak tinakot yan ni cedric na panindigan ang rape kuno na pangyayari napasubo na sila tycctv	?
430388403696570368	rt ben changed destiny thwarted rape instigated murder foresight blake curse thriller romance _url_	?
430389218645270528	hate waste rape friend	?
430397525385052160	rape _url_	?
430401398958993408	rt horrible important share facts violence women afghanistan endvaw http	?
430404673267191808	don try uploading game pornhub don allow rape	?
430406572540305408	nowplaying american lab rat religion rape tune _url_	?
430420967425589248	municipales la campagne virtuelle rape bastia scotche le directeur de office hlm _url_	?
430422451516764160	got explained dude cop night wanted tell violence women special	?
430449417217245184	not rape high meth	?
430452174728855552	cutting grass no punishment rape hold rapists police account kenya can set example world justiceforliz	?
430455377558528002	rt se haga tatuajes se rape media cabeza se ponga piercings se haga lo que se haga siempre ser carlos	?
430463381913358336	manchester city going rape chelsea	?
430467771282259968	don try uploading game pornhub don allow rape	?
430470716903788544	teamdylan woody allen living testament way society fails survivors sexual assault abuse _url_	?
430472623664156672	woman alleges abduction sexual assault lapd video side video _url_ via	?
430477906746150912	rt estimated cost violence perpetrated women disability will reach million dollars j	?
430486318112468992	rt big time bollywood actor director accused child rape us elite backwards brown ppl	?
430494367225503745	beyond one billion rising restorative justice approaches sexual assault _url_	?
430504941711409152	one three women may suffer abuse violence lifetime real sad real man job protect	?
430506375047692288	mt liberal vs conservative anti rape actions one _url_ _url_	?
430509540061487104	re unaware going keep keep busy sunday nfl fan anything else wanted rape twitter yesterday	?
430517420923420673	pope francis named former argentine junta insider prime mover child trafficking _url_ via	?
