426504474404737024	freedomprogramm zeeblebum frothydragon yes misogynist media never fails bemoan apparent false accusations rape	?
426515373530181633	girl faked rape jameis winston thot	?
426516550317645824	glad find serious social issue large rape humorous pts	?
426527410973343744	don care much hate bieber not make cissexist jokes wish rape upon	?
426531581902475265	rt benton ar police officer arrested charged rape _url_	?
426534461153370112	august year old rape victim attending big red high school volleyball game	?
426535586342907904	rt keyword mute bieber bc prison rape jokes think prison rape ever funny don want read	?
426549594537730049	talk sons make fucking terrified rape terrified putting foot wrong m fed sc	?
426553104868192256	rt bapuji caseno evidence rape fir medical report c ajay lamba knowthetruth pic twitter com soxmgscdg	?
426553423194882049	pat little girl head bless trp hungry expresses rape choti damini awaits arrestchorasia http	?
426556633502605312	justin bieber childish smiling mugshot smh rape will justice	?
426564139087962112	rt indian gang rape victim may raped platform village see bbc delhi correspondent rahul tandon	?
426569648591470592	former baylor football player tevin elliott sentenced years charges sexual assault	?
426570186012237824	online rape van octopus want drive	?
426586563883974656	groans rape	?
426599090554552320	indian village elders accused ordering gang rape series horrific cases focused international	?
426600101474500608	rt west bengal gang rape allegedy ordered village council stuns supreme court _url_	?
426623794719911936	court orders probe tribal rape india supreme court orders judge investigate gang rape	?
426653441260150784	even question backward ass cunts rt gang rape orders kangaroo court justified	?
426653884602261504	mt gang rape tribal girl orders kangaroo court justified share views	?
426664118162968576	indian court orders probe gang rape new delhi ap india supreme court ordered investigat	?
426675195060166656	hatian woman brutally tortured burned beaten yr old son death flyheight _url_ _url_	?
426680157370187776	research found educated women experience less violence educated girls less likely undergo female genital mutilation	?
426688891010428928	rt rape jokes ain funny unless re justin bieber jail bullying isn acceptable unless jus	?
426724796076785664	holdin days dragged stupid girl shouldn know shouldn know	?
426739037764739074	ceasefire southsudan agreements inc refraining sexualviolence _url_ bo un rape torture	?
426739079364227072	hang boy charged attempted murder rape _url_	?
426746982770548737	wanna rape bed hahahahahahahahaha	?
426747408219791360	rt justin bieber could rape someone fans still say leave alone make mistakes	?
426749989092466688	justin could rape someone yall praise like yaaaas gaga yaaaas	?
426762579755560960	myth sex trafficking super bowl hurt efforts stoptrafficking must read _url_	?
426770107550150656	nooooo lmfao uhoes police dont find enough evidence da rape charges drop _url_	?
426771038634926081	rt get beat regularly girl gives amazing slow blows okay blue mountain state university	?
426775874898120705	bands labels like donate something auctions re running rape crisis love hear	?
426781848505569280	isang grupo pala baka chicser yun ni rape si vhong tss grabeeeeee	?
426788732272799744	caleb say rape said rave comes	?
426799559797264384	rape incest	?
426807561497886720	rt justin bieber can sum parents rape little sister guys will still support	?
426816419079401472	rt rape threats rite passage women something say internet _url_	?
426827342132957184	rt unfounded dangerous accusation mizzou failed alleged rape victim killed _url_	?
426839705716420608	joangelsolament mass boy faces nd rape charge teacher killing mass boy indicted second rape charge _url_	?
426855989237649409	report mizzou didn investigate alleged rape football players female swimmer later committed suicide _url_	?
426857358619189248	remember wearing nightie not rape words coming gop	?
426865824620507136	ahaha rename group rape apologists	?
426884757168070656	woman beaten death outside nightclub supposedly photobombing picture _url_	?
426887202543382528	whore obviously no consent no choice whore message man want woman god says rape	?
426888934007009280	already not rape liked	?
426891682186264576	wait guy raped don believe man don get rape rape rather man woman	?
426895912569675776	ll rape nigga tweeting like bitch	?
426905229234143232	state made handgun named delhi rape victim day brent bambury cbc radio _url_	?
426920093092556800	dad gay marriage guilty child porn will keep san fran city pension _url_ computer didn police sex	?
426934015179104256	thiscouldbeusbutyouplayin _url_ omgs can breathe lmaoo face rape donee	?
426939367479730176	sea otters known rape drown baby seals	?
426942807140347904	sea otters known rape drown baby seals world crushed	?
426947182944477184	called rape	?
426951658082295808	rape city also said police work investigation fine kejriwal	?
426952407374127104	keep mindset everyone fuck coz will given opportunity fucking rape	?
426962840692744192	little children still symbol eternal marriage love duty george eliot	?
426962981495525376	little children still symbol eternal marriage love duty george eliot	?
426963913155289088	little children still symbol eternal marriage love duty george eliot	?
427003144074059776	sea otters known rape drown baby seals orvil	?
427003879717220352	security guard arrested rape mumbai hindu topnews _url_	?
427006009203097600	rape jokes pedophilic imagery one tweet hope someone arrests peddling child porn	?
427018691805708288	hehe awkward moment try rape someone ok	?
427024603098386432	sicko tries rape year old girl found car stole queens _url_	?
427031208845795328	rt rape case pending delhi courts action taken dcw past many years keen fast rack case somnath	?
427032619625107456	rt prayforvhongnavarro attempt rape helpless woman world live messed kament	?
427042064040087552	nakablotter daw si vhong navarro dahil sa rape	?
427058416373465088	anti rape agencies can convince till prosecute rafa nadal concerning roger federer	?
427070868523470848	fuk doon ll rape ur mum	?
427086132237451264	police search armed suspect behind sexual assaults rape west baltimore _url_	?
427096750407819264	rt education career marriage children order	?
427103849602908160	cdmb looks like bom gonna rape cl _url_	?
427117218258620416	even dat chopper pervy shirahoshi tells wants rape dx	?
427123481394675712	gang rape punishment not watch _url_ via	?
427126484223156224	know don rape old lady walkers	?
427129771831488512	can rape murder family beliebers will still support	?
427129897908453376	can rape murder family beliebers will still support	?
427145513104707584	keeping mind also bilbao beat united back rape current squad	?
427180739906772993	imagine justin tiny frightened penis looking quivering begs rape bottom	?
427188347468251136	rt sexual assault affront basic decency humanity president obama _url_	?
427190092340686848	rt sexual assault affront basic decency humanity president obama _url_	?
427190843569889280	can rape murder family beliebers will still support	?
427209664884137984	katy perry tweets thank speaking save american lives gun violence rock girl love _url_	?
427212097059975170	deputies man woman arrested human trafficking _url_ local	?
427214386713731072	rt deputies man woman arrested human trafficking _url_ local	?
427231803527942144	m usually thinkin date rape quoteyourroommate okmadmad	?
427233141237882880	looks like says bro rape bottom right	?
427234171652947968	rt pissed mountain dew bottle made girl drink got kicked cheer almost charged felony	?
427252983622303744	nigger white house alrrady rape raping us american stopobama _url_	?
427256598411870208	love rape	?
427257145374289920	rt august illegal alien arrested alabama rape sexual abuse years old girl sotu	?
427288774901383169	rt shocked people comfy using word rape mundane verb verb re sports establishing dominance let go	?
427291171312771072	sadly done little address far greater incidence domestic violence women deserve better	?
427309394804494337	demand end india rape epidemic forcechange _url_	?
427335392216760321	episode rape ashlyn ashlyn curo loveit pancakes teach satan _url_	?
427343566478643201	able wear whatever fuck want o fear someone might rape	?
427355178267082752	eh eh ban rape legal soweto	?
427355524955267072	aye won rape give consent	?
427367950165635072	text unli rape send directed gma	?
427368713159847936	ako si vhong navarro ni rape ko kaibigan ko o_o	?
427370517939503104	rt buzz ng bayan vhong navarro names year old woman accuses attempted rape denise millet cornejo	?
427380767346274304	rape need money denise millet cornejo	?
427387945122017280	gang rape woman found married man subalpur way don go police _url_	?
427389320102965248	gang rape woman found married man subalpur way don go police _url_	?
427389512428158976	darren sharper former nfl pro arrested rape darren sharper former _url_ darrensharper greenbaypackers	?
427395085610004480	gang rape woman found married man subalpur way don go police _url_	?
427396892557709314	rt kung attempted rape yung nangyari kay denise millet cornejo aba choosy pa siya vhong navarro na eh	?
427401363514220544	bbc revel truth gaddafi sex basement used rape young girls sick _url_	?
427411006818484224	race tanner car ll probably rape	?
427412837435064321	rt argentina group stray dogs saved year old girl man trying rape	?
427413412470349824	rt argentina group stray dogs saved year old girl man trying rape	?
427422704279359489	indian rape victim police protection woman said raped orders village elders _url_	?
427423408784416769	scores hell rape	?
427425690841935872	worried vhong navarro fiasco affect public perception rape culture enough victim blam	?
427431062415736832	_url_ hi can rape omg	?
427432809691500544	aiyu noona stalk m take bath rape	?
427438161338195968	rape tangina ginusto mo din yun ulul	?
427446663821529089	baka naman nakakalimutan ng gma yung issue ni vic sotto na din sa rape gmaphilippinesworstnetwork	?
427454417638416384	rt year old bravely rejected abortion rape now rapist attends school _url_ _url_	?
427456101026500609	rt year old bravely rejected abortion rape now rapist attends school _url_ _url_	?
427456116852015104	forced arranged marriage bestsell jo beverley kindle romance regency ebook _url_	?
427480919688380416	minus rape	?
427488280393682944	otl missouri informs police alleged rape university missouri released statement sunday saying university police tu	?
427489452374495232	rip year old girl subdivision illinois attacked pitbulls	?
427495961494298624	smoking mind rape _url_	?
427509981156741120	not rape enjoy	?
427510621840875520	elephants kill people every year known also rape kill grown rhinos holy shit	?
427512107492737024	otl missouri informs police alleged rape university missouri released statement sunday saying unive _url_	?
427512537995677696	feel like difference caretaker story disabled person secondary rape fantasy reader identifies	?
427517800924860416	whoa elephants kill people every year known also rape kill gro	?
427517896500076544	people laugh rape khs seriously not cool	?
427523345098481664	rape card soldier	?
427525259978223616	elephants kill people every year known also rape kill grown rhinos	?
427534951009906688	super bowl sex trafficking hysteria latest female victimhood myth great debunking _url_	?
427540688507789312	years otl missouri informs police alleged rape _url_	?
427542187002191872	rt rape jokes prosper can say d never really rape girl bc rape ripping clothes using weapo	?
427542618307067905	ruling tight jeans rape sets anger italy new york times _url_ see	?
427543978268176384	rt report spam rape just sex shame attache	?
427546328776704000	false story rape made media despite medical report denied rape attempt jayhindu _url_	?
427549402568605696	kendrick lamar don win grammys paying rape winner	?
427554259916578816	questionsforamnesty dont think better use yr platform condemning men pay rape women girls	?
427555182717976576	people worship tupac like wasn convicted rape	?
427562777704558592	feminists say redefining definition rape well re ones saying sex rape redefining	?
427566900080812032	niggas still tryna rape females now _url_ nigga	?
427571094006927360	denisse d says rape nt gmaphilippinesworstnetwork gma told us vhong blottered nt commit rape _url_	?
427578194829377536	rt studies come showing black women face highest rates domestic violence say	?
427593297113014275	midterms gonna completely rape grades	?
427607729952145408	although see sides aren two side anyway harass anti gay girl not	?
427618645074665472	robin thicke not artist release misogynistic music perpetuates sexism rape culture just hate	?
427618913086488578	robin thicke performing song rape wow cute	?
427619470887378945	robin thicke performing song rape wow cute	?
427619863792984064	date rape anthem summer blurredlines yuck	?
427620980865785856	date rape anthem waiting	?
427622831149441025	john legend could shit chest yank hair call names rape bung hole still voice everygirl	?
427632043460411393	date rape anthem summer blurredlines yuck	?
427633513739718657	date rape anthem summer blurredlines yuck	?
427640233606119424	robin thicke performing song rape wow cute	?
427652625316986880	want carry robin thicke baby jk wouldn choice bc rape write song abt	?
427672141010456576	hellooo hate blurred lines think rape love hear thoughts _url_	?
427673606462509056	lorde lookin like abouuta rape someone	?
427685154392272896	rt dear gma porket comedian na pogi rape agad wow hiyang hiya naman ako kay wally bayola na mas masahol pa sa ibinibintan	?
427699885693865984	danish tourist gang raped india another tourist allegation rape highlights india problem	?
427708341725298688	rt yf like really imma rape broom stick hop notificationa	?
427714325940158464	part snoop dog tries rape yvette like noooo	?
427721225285025792	ndi lang po pathetic desperada din rape daw si deniece naman mismo ang nagtex kay vhong para pmunta sya sa condo nya	?
427728212689317888	lee insists vhong wanted rape female friend businessman cedric lee tagged actor _url_	?
427746590183288832	just agree na disregard nalang un attempted rape can just disregarded accused person begged hmm	?
427747503795343360	_url_ potato madness final rape	?
427763459087163392	rape culture university needs urgent action _url_	?
427763679556141056	sinabi po ni deniece na ni rape daw ni vhong si deniece pero hindi po totoo ang sinasabi niya naniniwala po ako na hindi rapis si vhong	?
427765285722918912	rape satirical wake people _url_	?
427767674995634176	bakit di tinuloy ang blotter dahil ayaw nila lumaki ang gulo jusko rape yun kung totoo nga na nirape ka dapit itulo	?
427768476451627008	ni rape daw pero putok na putok ang blush contour sa baba	?
427770535951351808	kung vhong ma rape skon ok lg ah hahahahahahahahhaa	?
427774359445323776	pag na rape ka pala sa batangas pwede ka mag file na case sa spd hmmm salamat sa makabagong kaalaman cedric lee galing	?
427777035549691905	ang assumera nitong si deniece ni rape daw ni vhong	?
427778577669447680	kung umiyak si deniece sa mga interview na maawa ako sa kanya pero hindi eh grabe ni rape daw pero ang saya shemayyy wtf	?
427781360942841856	vofnimo year old teenager nabbed charms year old woman beaten pulp hoodlums storm ibada _url_	?
427787282176016384	rt m taking beating no choice rape	?
427798010152505344	never history delhi rape occurred republic day yet another feat _url_	?
427809711434371072	read marriage deathlok deadpool wondered child face even mother could love	?
427839943713751041	rt almost posted rape joke got scared someone might take invitation rape hard express urself day	?
427841929984749568	honestly believe woman invites man place late night credibility claim rape tv	?
427847110441324544	no future se ore buskense una mujer que sea buena te rape bien no time waste bs _url_	?
427847154518859776	re silence greatest asset take stand domestic violence sexual assault don silent longer	?
427851559717044224	rt raping lmfbbao rape thiscouldbeusbutyouplayin _url_	?
427854218826117120	read dissertation saskia van barneveldt development rape genocide cases uva	?
427863701463384064	dear underclassmen take ap gov econ re stupid fuck bc shit gonna rape social life gpa le	?
427874804612751361	rt rape dumbest crime ever rape innocent person hoes throwing pussy around	?
427877478095663104	rape tweet lands uk couple jail europe news india today _url_	?
427879886720475136	know got beat _url_ fuck going see later	?
427888690786889728	indian gang rape ordered elders video secured police indian police video footage photogr _url_	?
427891725588131840	police open case alleged missouri rape _url_	?
427893248518926336	can rape murder family beliebers will still support	?
427900233356693505	can rape murder family beliebers will still support	?
427902824752898049	questionsforamnesty advocating legalization shown increase sex trafficking _url_	?
427919415607189505	year old transgender female islan nettles died savagely beaten death attacker _url_	?
427924426332831745	wasnt date rape reference dentist clearificationtweet	?
427941416028110848	rt agua ferrocarril alimentaci son los pilares de esta integraci rape	?
427966949315067904	rt not hezbollah saa waiting permits syria gives soldiers religious permission rape syria _url_	?
427971579105263616	wait let rape someone first	?
427980466495688704	filipino love team deniece cornejo says attempted rape vhong navarro cedric lee update _url_	?
427992710889209856	rt considered extreme not allow rape incest exceptions abortion now txl	?
427994004437757952	bluestarmom ex girlfriend accused rape long gone nsa can help	?
427995337861898240	rape _url_	?
428004804153995264	ahahahaha remember girl said boyfriend use beat ass rob asked squared	?
428011741864157185	war women continues gop candidates txltgov oppose rape incest exceptions abortion _url_	?
428017801001832448	rt zayn girls react says girl basically kicked harry america keep away kendall	?
428022752453206017	help make happen destinyjones short filmnoir addressing rape crowdfunding indiegogo _url_	?
428072857180983296	bull shit army jawan booked rape month old baby _url_	?
428080151394390016	rt girl screams rape men happen hear enter unlocked door beat guy take pics police blotter no charge filed nor	?
428081068227301377	ano iyon pakana lang rt girl screams rape men happen hear enter unlocked door cont _url_	?
428085343594614784	riots proceedings initiated rape accused _url_ outlook wires	?
428088787886170113	rt not like creepy going rape way m going murder way	?
428088987631099905	richard sherman bout rape broncos come faster superbowl	?
428090492073816065	rick ross arrested morning rape underage miami girl article _url_	?
428090503973056512	rick ross arrested morning rape underage miami girl article _url_	?
428090510205804544	rick ross arrested morning rape underage miami girl article _url_	?
428090516551794688	rick ross arrested morning rape underage miami girl article _url_	?
428091847475728384	rick ross arrested morning rape underage miami girl article _url_	?
428112974365335552	real rape victims crying suffering trauma deniece rape victim well make feelin fresh no emotion justiceforvhongnavarro	?
428115047240318978	lies cedric lee min interval tas rape oh come	?
428119646139473921	attempted rape hhahahahahahah	?
428132729264148480	pls look read share retweet link _url_ messages vhong navarro rape issue	?
428138233340628992	obama promises veto republican bill forces irs investigate rape victims _url_ via	?
428144861414301696	rape not something move idiot kahit years ago pa yan	?
428154503783645184	former nfl player darren sharper arrested suspicion rape _url_	?
428155627798814720	disabled people rape will always funny things happens someone close truth	?
428159360234455040	rt rapper rick ross arrested morning rape underage miami girl using drug called molly page http	?
428159428794535936	rt rapper rick ross arrested morning rape underage miami girl using drug called molly page http	?
428159912766476288	bakit mag iinvite ng lalake ang isang babae sa pm ng gabi na pumunta sa kanyang condo mag aakusa ng rape bitch plea	?
428160427227635712	rt rapper rick ross arrested morning rape underage miami girl using drug called molly page _url_	?
428160916643782656	rt rapper rick ross arrested morning rape underage miami girl using drug called molly page _url_	?
428165216182870016	kadiri naman rape agad hahaha	?
428180240670928896	rt bclinton escaped accusation rape broaddrick assault willey jones harassment jones ladies maligned eith	?
428200378992427008	rt real men dont rape real women dont expose body right	?
428201374229082112	duck tape butt rape stick nigga	?
428208799971692544	bothering swear look like rape kids creeeep feel sorry baby _url_	?
428219998331363328	yeah stop stalking women handsoff	?
428222490695835648	penn state federal investigation sexual assault reports _url_ ekogidi	?
428236299384791040	guys stfu don even know called rape	?
428248346353221632	hero will show no pain getting beaten will show pain woman trying clear wound	?
428256589678526464	basically o boring death woman victim multiple rape guy actually developed	?
428264879439765504	want unputdownable child trafficking page turner torn today headlines _url_	?
428282278695825408	yorkreye nypd conducts pre super bowl crackdown sex trafficking _url_	?
428287910799241216	rt rape rape friend rape rape	?
428288555333734400	rt rape god will homosexuality choice talk making shit go along	?
428296889880936448	guy trying make jokes rape fuck wrong	?
428308140564955136	watch abc fugitive wanted counts rape norristown _url_ _url_	?
428317909770047488	rape culture college campuses must end _url_	?
428324427042803712	rt harry qu significa rape vi lame ok pero conste que lo pediste no no qu haces llate qu ta	?
428338773697392640	rt rape god will homosexuality choice talk making shit go along	?
428349185214386176	rape periods abuses abortion pregnancy harassment breast cancer walked cheated femal	?
428350976215359488	monster ganyan ba itsura ng na rape di baleng bisaya wag lang maging katulad mo etchosera ka eh ano ngayon kung bisaya	?
428356330357657600	_url_ potus vpotus nail talking sexual assault women	?
428357408759771137	rt rapper kanye west arrested morning rape underage miami girl using drug called molly page http	?
428357807663222784	rt rapper kanye west arrested morning rape underage miami girl using drug called molly page _url_	?
428357862038200320	rt rapper kanye west arrested morning rape underage miami girl using drug called molly page _url_	?
428357882623836160	rt rapper kanye west arrested morning rape underage miami girl using drug called molly page _url_	?
428358455146336256	rt rapper kanye arrested morning rape underage miami girl using drug called molly page _url_	?
428363115307085825	rt shoes men women children fleeing violence southsudan tell us much via _url_	?
428366755342585856	big no mention rape military sotu	?
428371356728983552	rt cathy mcmorris rodgers m inspired year old force women carry babies rape incest sotu gopr	?
428372062642507776	rt ancient rome men found guilty rape testicles crushed two stones	?
428372079462055936	remember um fan held hi lizzy seeberg sign gameday taunt nd re sexual assault allegations well _url_	?
428374718681337858	lmao rape one	?
428376162759614464	dont wanna rape ya just want paper	?
428376534286893056	abc fugitive wanted counts rape norristown _url_ _url_ ass fuckin	?
428379654605389824	rape whistle mean background music	?
428383728025362432	really rape got boobs come now	?
428386115200901120	brady hoke covered rape allegation lied protect rapist must fired _url_	?
428386146708516864	never rape sex will always consensual version pillow talk romantic words ive ever uttered	?
428392933814173696	destiel superwholocked babyyoureacriminal chosenprat punched guy bc making rape jokes _url_	?
428399033615273984	rt don know say see life destroyed asylum seeker criticises response rape claims _url_	?
428415224509526017	not rape surprise sex	?
428419489412030464	rt muntik ka na palang ma rape teh pero yung re rape sa yo nasa kwarto mo ikaw nasa lobby sana nakipag phone sex ka na la	?
428434835166986241	didn kill rape molest kids no shit just drugs black dude nearly raping ass	?
428438257894846464	ncp leader doesn know rape happens due pervert mindset abt unreported rapes happen minors toddlers	?
428440180081434624	rt lady group pulled kapil sharma joke pregnant women feels rape woman fault	?
428444468463669248	en route glean high forced marriage pretreat whereas brumal ixecmv	?
428447484201824256	burglar returned rape victim awesome courage saved _url_	?
428458468907810816	ncp woman leader says dec victim blamed rape _url_	?
428461147248160768	rt real rape victims crying suffering trauma uncomfortable deniece rape victim make feeling fresh	?
428475916402970624	chapter closed wanna knw heights feminism man falsely accused gf rape acquitte	?
428481237120860160	tvpatrol paano kaya isisingit ni cornejo ang rape sa mins hirap na nga yung attempted rape eh	?
428487229330423808	sex girlfriend day kept yelling guy name hell rape	?
428487476605239296	rt pag na rape nanlaban yan usually sugat pasa bali sa katawan pero teka sino ba mas mukhang na rape si vhong si	?
428488927561793536	rt pag na rape nanlaban yan usually sugat pasa bali sa katawan pero teka sino ba mas mukhang na rape si vhong si	?
428488954816368640	dumating si vhong lumabas si deniece dumating si cedric less mins ni rape agad ano minute win	?
428489373999316992	rt rape mins ano pagkapasok labas agad	?
428491044322156544	may kausap pa si deniece sa labas ng condo paano yong rape woooow justiceforvhongnavarro	?
428492037097140225	don know insisting rape attempted rape thing pretty obvious huh abscbn tvpatrol	?
