418171178436419584	rt black women talk rape white men ppl seem think just holding pain slavery	?
418172865955909632	kansas city hottest club horrifying rape joke _url_	?
418182216871841792	downplaying situation re slut shaming endorsing sexual assault	?
418211771011186689	rape est comendo viva	?
418264878504083456	keep thegoing stop rape tonight	?
418265430294155264	omggg know bitch aint rape maggie walkingdead	?
418280276544872448	bad rape	?
418281972101038080	filed complaint twitter bm posting photo incapacitated bw threat rape now gonna contact buddy sourc	?
418282369775591424	keep thegoing stop rape tonight _url_	?
418288638032506880	don rape travis please ll cry	?
418292917396983808	cavemen first invent rape hot head bitch wakes pregnant fuck	?
418310872658747392	hahahaha konyat well mahal rape ka sakn bukas	?
418318307901448193	end rape now	?
418360631436124160	follow will rape	?
418368774878674944	like phone rape	?
418399064015663106	holdaper na gwapo girl rape rape rape holdaper anong rape holdap lang girl bakit masama bang mag suggest ang landi	?
418401222329393152	rt not job coddle educate young black men comes violence women wanna teach	?
418408717814874112	many women believe must beaten partners hetero homo relationships alike	?
418410013607346176	rt sexual assault not sexual desire violence control humiliation	?
418421707347460097	serious sex attack edinburgh year old woman victim serious sexual assault edin	?
418441771584987136	cha seung won son cha no ah acquitted sexual assault charges _url_	?
418443712390131712	cha seung won son cha no ah acquitted sexual assault charges back august pro gamer cha _url_	?
418445075170201600	rt women need protect men urge rape men need protect urge kill th	?
418447257755996161	welcome diehardforgirls fierce books fierce women men attacked kindle _url_	?
418448440524173312	rape disgusting crime	?
418462372974854144	don agree fans giving players shite re least week can rape much money safc	?
418463833032646656	police investigating ga man tweeted going rape passed girl _url_	?
418465017982623744	rt estoy pensando de hacer algo del estilo si consigo likes en un dejo que rape pero no tengo pelot	?
418467048012775424	real dude think witnessed like rapes athens one black guy picked girl floor dragged	?
418470405356388352	rt rape dumb rape innocent person hoes fucking free	?
418479262362894336	white chick come banging door no shoes no pants talking can let black dudes tryna rape	?
418481220113035264	carl stop please eastenders omg no rape	?
418513762555920385	_url_ avery important blog rape stop mini skirt blaming	?
418513965941919744	male ducks rape female ducks helps	?
418519545490718721	devil rape dat fool dat brought world aint cheap bloody hoe smh waste tweet fuck mentions freak	?
418523898334806016	talk rape leads first point abstinence key	?
418524867651059712	cobb co pd investigating man tweeted picture morning saying going rape girl http	?
418527341602545664	rt yard penalty unnecessary rape _url_	?
418535150046048256	rape	?
418542358104264704	girl mmmm show gonna beat pu baby _url_	?
418544729568325634	tl used raise awareness eveslaw evesmarker domesticviolence osc childabuse rape stalking abuse not	?
418547569887694848	pizza won ever call names cheat beat lie fake rape girls dat	?
418551894387064832	callmeoldfashioned think marriage come children	?
418553383474450432	people fucking idiots rape always rapists fault someon	?
418555527954989057	baltimore city police need help locating sexual assault suspect _url_ _url_	?
418594266647392256	m rape	?
418597143197536256	isn rape	?
418606891359404032	dusting association ugg stake could rape professional dawdle tmetmo	?
418609269429125120	good see balanced report implies violence men women	?
418610224208285697	world come re dating year old rape whole level re dating child	?
418614978443096065	geeekin retweet stalking ass girl	?
418665850481434624	congress supporting aap delhi safe mla not arrested false woman not arrested rape http	?
418668953893105664	hi terrible decision include rape charge avoider julian assange today joke	?
418678847169511424	rape can never blamed victim wise man builds glass house near stone quarry	?
418684100967284736	urge rape _url_	?
418712592144924672	not give man accused rape airtime nor extremist unless real news shame bbc	?
418718114743074816	rt rape dumbest crime ever rape innocent person many hoes days	?
418726398312738816	attn women fastest way lose weight burn fat stop fat production _url_	?
418726450242416642	attn women fastest way lose weight burn fat stop fat production _url_	?
419231838838996992	rape meeeee worldstagenirvana	?
419234985011597312	dude rape drunk feed cat food tell snack mix gon learn today	?
419236798762459137	rape whistle another sec will fall tonight big osu mizz cottonbowl okstate	?
419242277618204672	nirvana rape solo acoustic _url_	?
419268988120887297	rt facebookproblemsnight like respect justin bieber ignore want satan rape	?
419274196229697536	sexual assault military control ruling suicide outrageous _url_ htt	?
419283441893396480	rt campaign s citizen victims predominantly found sex trafficking underage victims often runaways troubled hom	?
419288119121158144	chance violently rape diplos face missed life	?
419293908712316928	rt first girl attacked movie jaws screaming real pain harness broke hip dragged	?
419300092575617025	mom got raped girls can rape willing like mans dream	?
419303226971009024	rt rape dumbest crime ever rape innocent person hoes throwing pussy around	?
419304327866769408	rt first girl attacked movie jaws screaming real pain harness broke hip dragged	?
419316999995789313	rt worcester state commonly chosen major sexual assault smack	?
419323733539442688	apafrom blowhole rape weirdest thing seen aggro badgers galleries tmituesda	?
419330274086748160	best friend says gonna rape shouldibeworried freak	?
419333658843955200	rt worst things said women abortion rape _url_	?
419348152626737152	cheek rape	?
419349839046914048	wrong cthulhu tentacle rape anyway waiting backlash cthulhu tentacle rape victims	?
419354893594263552	worst things said women abortion rape _url_ short memories	?
419356433608474624	pucha wag niyong rape si vhong	?
419406201324318720	causes rape _url_	?
419447159566921728	kind rape isn crime corrective rape used cure lesbianism	?
419450939360038912	imagine dj holdap rape rape tulungan nyo ko dj holdap di rape edi wag nags suggest lang ee	?
419457369702035456	ill rape little pretty foxy know	?
419471333337362432	want oomf rape la want ro sexually abuse like no ones business	?
419477596133679104	seen newspaper india country one highest rates rape sexual abuse	?
419481255261253632	rt seen newspaper india country one highest rates rape sexual abuse _url_	?
419500404687130625	causes rape _url_	?
419521475146973184	rt artilary shelling airstrikes kidnappings rape gang rape murder kachin women attacks civilians continue	?
419523240164610048	rt just loss white girl guessing rap lyrics turns race card gets kicked popeye chicken	?
419530340257239040	sbs come crime watch never looking gang white people connection rape	?
419532626748133376	accused someone rape didn arrested since done famous person internet fine	?
419542305872158722	nigga rape	?
419543761970929664	lsugjing hard bc asian jer s rape snd screaming bc cant breathes bc ph	?
419548987872391168	rt morrissey silly silly bitch eating animals just paedophilia rape murder _url_	?
419553466617704448	will centre halves around kent experiencing rape mate	?
419566683792375808	rt rape doesn exist dubai considered casual sex crime punishable law world news _url_	?
419575774384259072	nou felicite kontan pou izolan ki ranpote tit rape pou ane ki sot pase ya nou fye deskel te kolabore avec nou na	?
419591904183857152	bengal rape victim family meet president indian express india _url_	?
419604534319521792	rt morrissey silly silly bitch eating animals just paedophilia rape murder _url_	?
419606318790348800	bethenny frankel new muscle man accused rape college no charges filed thoug _url_	?
419630713697488896	no million stories zionist rape world just watch _url_ disarmisrael _url_	?
419645240640020480	rt award winning documentary sex trafficking now available streaming online _url_	?
419675154294120448	rt la sheriff department misconduct includes rape drug smuggling kidnapping report _url_	?
419678256950833153	know face looks like rape idk like emoji idk cant find	?
419678773911371776	msia radios no discussion gangsterism child marriage drug mule scams illegal cats dogs breeding factory	?
419685265922207744	oh god no eat will rape inside	?
419689683329638400	ah believe woman responsibility stop rape huh	?
419695042266017793	damn girl gonna need fly antarctic find enough ice burn	?
419698449366646784	long night gossip girl facebook stalking	?
419704704768417792	girrrlll fine fuck rape put trophy case rapist	?
419715904079794176	go ahead rape face win win	?
419716637755850753	m just going listen song mins seconds later proceeds rape replay button	?
419720071309950976	oh ignore girl stalking	?
419728043234435072	just rape phone death xd	?
419744165678022656	tryna get lil girl beat like	?
419751955582685184	swear little girl stalking ugh ima block ass cant deal aggravating kids	?
419773154991816704	rt bro dark artful well developed comedy great subliminal though unintended justification rape not	?
419798318445637632	gue disuruh ijal ke rape center semalem gue di rumah lu di tempat prostitusi jadi gue gak bakalan bajak	?
419803473744781312	rt one can point endorsed rape please indicate take time ll wait	?
419825355017695232	quote comedian resurrected old joke justify rape nincompoop word	?
419827442317262848	rt managed fit casual racism transactional relationships misogyny pro rape agenda one joke talent	?
419849077975576576	rt neither rape nor molestation still asaram bapuji jailed fake charges paidmedia judge bailon thjan http	?
419850226552541184	just part tries rape girl loves sex laughs small god	?
419866997921697792	hope swansea absolutely rape man	?
419875719792295937	rape not fucking joke pieces horse shit	?
419876594337845248	respond someone says could rape could	?
419917623304794112	comedian basketmouth apologizes rape joke enrages people lashed demand glo dump _url_	?
419921728899657728	hate slutty girl hope burn hell shit public	?
419931793950015488	new post opinion basketmouth rape joke not funny _url_	?
419939341126098944	toronto taxi driver charged sexual assault _url_ brown guys rapping tingz aye	?
419941248904867840	state trying rape missouri cries missouri misery	?
419958284942966784	xdddd hahahah omg rape uhhh jaaaa sie ist halbnackt naja sie hat nur ein sschen	?
419965679505506304	rt things never ever glamourised eating disorders depression mental illness rape paedophilia racism	?
419980582089940992	rt last week liverpool fans attacked bus full hull fans women children stabbed oldham	?
419999942170902528	rt last week liverpool fans attacked bus full hull fans women children stabbed oldham	?
420006330246520832	yep essentially blowhole rape	?
420014010352664576	ihatewhenpeople think rape okay asking no matter slutty someone looks doesn mean re asking	?
420021998778331136	alleged rape girl ws playin next days ashram wid kids posible girl bhave normally aftr	?
420037202215591936	steubenville rape update ma lik richmond released _url_ wtf	?
420037222499229697	rape lyk now culture india	?
420044583494762496	rt conversation better sons early possible _url_ sexualharassment rape st	?
420046651399888896	rt no court settlement rape case says high court _url_	?
420049445720309761	m surprised liberals haven tried introduce idea rape dogs instead rape whistles	?
420058178882007040	shut ur mine not make rape jokes	?
420073770095628288	rape case aftr yrs not accepted court advocate menon yr old fake case asaram bapuji bailon thjan	?
420078733144231936	omfg lmao fun games butt fuck auburn time might actually considered rape bitches	?
420086293280718848	someone sang matters biebs id rape	?
420114442542542848	rt need talk abortion sex tampons female genital mutilation rape domestic violence muc	?
420131835826696193	rt idan raichel israeli world music star endorses torture rape arab prisoners _url_	?
420139141582422016	said wanna rape chancho lmfa	?
420144432755646464	say rape ever heard statutory rape google unbelievable	?
420154582811951104	year old saint accused sexual assault kidding bailon thjan _url_	?
420162420410441728	rt friend look d date rape friend need work compliments	?
420166132990234624	rt someone today planet earth someone will slut shame rape victim	?
420179172628369408	thing virtual rape	?
420182719549538305	tis not rape ask	?
420189754748317696	smh not rape make orgasm element sarcasm m not agreement	?
420199472363487232	lmao stretch theory may just safe say probability nigerians products rape almost kai	?
420202391066406912	rt national migration week pray children undocumented refugees human trafficking victims _url_	?
420203193453133824	law equal every arrest rahul gandhi inquire happened rape case	?
420205652691009536	judge india rails immoral premarital sex rape trial indian judge declared premarit _url_	?
420207591080607744	implies encouraging rape people arms idiots following lead self appointed	?
420209282911862784	tragic thing happened beaten mob justice luckily enough beaten kind woman	?
420216074781466625	still don understand issue rape marriage tho bible says husbands wives not deny sex na	?
420225886043258880	signifies least every nigerian men rape thk shd use words appropriately	?
420229367722045440	rt can preacher celibacy turned thousands youth lives better sexually harass girl sheer false bailon	?
420232672422535168	let pray idiot tf wishes rape anybody pure sad tbfh	?
420249555222142976	want rape someone eue	?
420250000677818368	titanjoyofgifting ur child birthday festive occasion marriage anniversary just complete	?
420253580176551936	twittbo ching chang chong rape case japan koera population japan million korea fifty millio koera crazy	?
420258115821395968	mt basketmouth regrets rape joke _url_	?
420264799139008512	ohio high school rape convict released usa today _url_	?
420269150318366720	il rape aussi	?
420289553954373632	lmfaooo blocked year ago fuck pussy wants retail sells rape fuckhim	?
420299061305286656	rt notyourrescueproject talk selling bodies commodifying objectfying paying rape etc express attitudes masquerad	?
420320764290932736	newjersey plans combat sex trafficking next months _url_ sb	?
420321839660142592	used mad disrespectful high school idk never got beat lml girl boyfriend ever cheat	?
420349366545555456	mgs gets sexual violence rating description	?
420354278226919424	normally just root good game bowl games tonight m rooting sexual assault go tigers	?
420361258039136256	korean rape history _url_	?
420363241554837505	jameis one rape commit auburn	?
420365755171864577	o judging name can tell enjoy killing beautiful women just like gettin ass kicked	?
420369918702284801	guns chose girl kicked house	?
420376519567884288	time interesting player backstory fsu qb jameis winston committed rape got away won heisman hero	?
420378181544067073	cant rape white girl lose game smh choose struggle	?
420379783638564864	well winston failing rape sober defense	?
420381120920711168	cool place date tbh _url_ nobody can hear screams rape	?
420381855368499200	medical report proved no rape investigation officers said no sec rape case bapuji want bailon thjan	?
420382546707226624	hardcore ufosbuzards dreadful crowstractor rape chain one hardest onetwothree punches music bee thousan	?
420385799063212032	beat rape charge can beat auburn	?
420389433519513600	jamies just forgot get daily rape	?
420389497184866304	rt guy next says can win hesiman beat rape case win natty gotta lose least one	?
420390363497365504	jameis winston accused rape gets no suspension carlos hyde gets hit girl doesn swing back suspend games class	?
420390386658738177	rt guy next says can win hesiman beat rape case win natty gotta lose least one	?
420391060003495936	official bu rape whistle don blow unless actually happening	?
420401325994967040	everyone keep making winston rape jokes wasn even charged	?
420405979843674113	rt just don f king rape people didn think d write one ya god perspective bo burnham	?
420412736082681857	ve old bull now want young calf rape	?
420416641889886208	jameis not like side rape wareagle sec	?
420417253394219008	cmon jameis rape auburn just like one girl cold	?
420418993388662784	refs giving one fsu otherwise winston will rape bcschampionship	?
420420186957557760	plot twist winston rape case true fsu forfeits wins season	?
420420803042082816	rt nigga beat rape case won heisman national championship man deserves medal	?
420421045082808320	now people wanna use rape card gtfoh yall ass can never let mfka win just stfu real mad asses	?
420421054025056256	jameis winston rape victim gladly give willingly tonight	?
420421436126535681	bitch claimed rape must feelin salty af tho lmaoo	?
420421540627238912	m gonna rape bitch can win national championship	?
420421545253949440	rt jameis winston first rape girl rape defence famousjameis	?
420421704658059264	rt won heisman beat rape case national champion bday famous jameis ladies gentleman	?
420422035211554817	rt jameis winston won heisman beat rape case won national championship nobody better	?
420422068773982208	rt won heisman beat rape case national champion bday famous jameis ladies gentleman	?
420422069986541569	yeah rape something hard af go get away especially without losing money facing consequences	?
420422086281416704	winston finna go rape many people bruh wardamneagle	?
420422126001070080	rape rap ra ri rin ring	?
420422192753430528	book gonna titled get away rape leads success	?
420422299851165696	didn rape nobody	?
420422542306709504	someone dumb actually think can successfully pull rape	?
420422810943504385	rt years old win national championship heisman get away rape real ass nigga	?
420422846167277568	fsu jameis winston come behind win no date rape pill needed time	?
420423025004011520	jameis get away rape twice	?
420423282416836609	rt years old win national championship heisman get away rape real ass nigga	?
420423406350123008	hearing jameis winston interview guilty rape not able read	?
420423590647828482	jameis winston gonna rape many girls tonight	?
420423623250161664	rt years old win national championship heisman get away rape real ass nigga	?
420423858320322560	rt guess can win heisman trophy bcschampionship rape trial season winston	?
420423904050438144	rape dat white gurl	?
420424235031744512	rt nigga jameis winston beat rape charge won heisman national championship	?
420424450027573248	really not going thank lawyer got innocent rape	?
420424470609035264	yo rape jokes jameis got like _url_	?
420424550866616320	know guys gotten away rape know ones falsely accused	?
420424932313419776	rt years old win national championship heisman get away rape real ass nigga	?
420425179186335744	winston innocent rape sandusky bcschampionship tiitletalk	?
420425396946231296	soo basically re pretty good sports okay rape girl	?
420425471621599232	don think funny people make jameis winston rape jokes	?
420425759266988032	jameis winston won heisman freshman beat rape charge won bcs title game luckiest nigga wo	?
420427147678072832	bet trying lynch folks au tonight just got beat byva black qb beat rape charge white girl	?
420428205129228288	rt years old win national championship heisman get away rape real ass nigga	?
420428373920600064	trying find girl rape	?
420429633704579072	rt guess can win heisman trophy bcschampionship rape trial season winston	?
420431107709239296	everybody wanna knock jameis winston rape case even happen people make mistakes judge	?
420431246544879616	wanna make jameis winston rape joke just taking advantage situation	?
420432110323642368	rt jameis winston first rape girl rape defence	?
420434102974545920	please not romanticize rape	?
420434202153078784	jameis winston season highlights wins losses bcs national championship rape failed english exams	?
420434494949044224	people hating winston brining rape charge no reason smh kid just something none will ever	?
420434540109131777	rt jameis winston won heisman national championship went undefeated beat rape case best year ever	?
420435933553381376	sexual assault case court order tarun tejpal bail plea today _url_	?
420436315612528640	women scream rape men want raped women facts	?
420437928008228864	come rape jokes hatersgonnahate	?
420438533057552384	kobe raped won ring big ben raped won ring jamis winston raped won ring rape da way go guess	?
420439861284192256	rt guess can win heisman trophy bcschampionship rape trial season winston	?
420447048723595264	rt jameis winston luckiest black man america beats rape charge wins heisman championship freshman	?
420457103711830016	good re getting sick america worshiping semi literate youth rap sheet sexual assault charges	?
420467462870544385	orr drop kicked girl tonight	?
420473300519616512	hate break guys rape sexual assault jokes aren funny disgusted	?
420479970918428672	gang rape strictly prohibited _url_ gang rape whatta	?
420485606565625856	steubenville rape case one convicted teens released juvenile prison one former high school fo _url_	?
420501721530372097	readingnow news steubenville rape case one convicted teens released _url_ _url_ socialmedia	?
420504964989845504	rt first girl attacked movie jaws screaming real pain harness broke hip dragged	?
420505955025973248	clicked stop violence women _url_	?
420520647005990912	teenage girl left serious hand injury attacked cannock yesterday evening _url_	?
420541081818656769	m talk weddings necessary mom never know could get kidnaped forced marriage important	?
420543084410044416	sisigaw talaga ako ng rape	?
420548539194675200	jameis winston won heisman freshman beat rape charge won bcs title game luckiest nigga wo	?
420553191449567233	rt jameis winston best month ever won heisman national championship avoided rape charge	?
420559043980058626	former neighbor ariel castro pleaded guilty rape murder _url_	?
420562787157303297	re advocating revolting story sexual assault nothing exploitative titillation stopviolenceagainstwomen	?
420565837926248448	que yo sepa una mejor no se puede quedar calva menos se rape el pelo	?
420576052818501632	take rape culture amazing _url_	?
420580549045256192	steubenville rape release not well received many circles noapologybutihadittough _url_	?
420580794495959040	rt moralmonday ga school prison pipeline update steubenville rape case women aren welcome internet htt	?
420592186053632001	rule law legality marriage children using father surname letter agape watch _url_ via ptvph	?
420603915475095552	revealed serving police officers accused crimes include rape abduction racism _url_	?
420604616062271488	rt wow amanda ll rape feel women aren welcome internet _url_ mustread	?
420612843965530112	cincinnati montana judge criticized teacher student rape case step _url_	?
420628537679556608	burn girl make hot like room fire	?
420631668127301632	rt percenter rape can take minutes happen affects victim decades whether victim male female lifeti	?
420633521187590145	actually slogan shud join hands rape future india	?
420634899100758018	take rape culture amazing _url_ love whoever made	?
420640299103166464	said mile nah gon try beat fuck girl seen mile	?
420647330103439360	jameis winston season highlights wins losses bcs national championship rape failed english exams	?
420648166153654272	jameis winston season highlights wins losses bcs national championship rape failed english exams	?
420649448180817920	jameis winston season highlights wins losses bcs national championship rape failed english exams	?
420656952696659968	bello molto fashion piacciono le rape per non le mangio mai hg discorso woow	?
420673023386337280	fuck like moyes daughter land now will rape just	?
420674770879787008	ll rape _url_	?
420687063831564288	learned back white hobo whores lied rape getting raped black men avoid jail history today	?
420690317067575296	bullied teen girl maryville rape case hospitalized apparent suicide attempt raw story _url_ smh	?
420696940679290880	yes victimhood complex female friends twitter ve stalked years threatened rape	?
420707981916127232	rtega rape	?
420709371484467201	men commit rape totally fault doesn matter women wear	?
420713000220508160	can josie m not made let girl take beaten	?
420717683236036608	take rape culture amazing _url_	?
420722653356244992	rape not plot device shitty game	?
420726514812874752	ima rape rape	?
420733025630945280	mays richmond ones charged rape though evidence recovered knight sec suggest otherwise	?
420739269204770816	women vancouver getting attacked major intersections council citizens going	?
420746078234099712	rt maps stars rated strong disturbing violence sexual content graphic nudity language	?
420757608203821056	innocent human will forever alleged rape allegations pinned name bbecause someone played game no	?
420773392883527680	don rape whistle sebring pretty much thing qotn	?
420774119928393728	child rape blackmail scum state _url_	?
420776180837412866	na little ese going wake little girl going get ass beat waking	?
420794216613036032	rt jameis winston beat rape charge won heisman became national champion just like kobe real nigg	?
420808485774049280	rt couple bed girl sad bc mom dead can make feel better yeah boy lights camel gonna burn just b	?
420832335563464704	dnt see paul tryna rape oh nah ok fuck lolthey can continue wtf book	?
420834023120728064	national union journalists clear guidelines reporting sexual violence _url_	?
420853173042302976	popped molly woke guy unbuttoning pants woo rape	?
420855122621902848	rape definition compassionate way show love someone else sentence johny raped diana dance	?
420864046166839296	can rape actually	?
