423906356706701312	rape isn sexual kink ignorant fucking waste oxygen rantjuststarting	?
423917226094104576	yo lo dije iba rapar rape	?
423923904714113024	rt democracy now okinawa revolt decades rape environmental harm s military spur residents rise http	?
423936308403535872	people ask hate tried get skype could talk rape not like pedophiles creepy	?
423938063812030464	unacceptable police florida discovered nearly rape kits sat untested since _url_	?
423945263250944002	okinawa revolt decades rape environmental harm s military spur residents rise _url_	?
423966203887890432	rising cases rape _url_	?
423975152830140416	cunts rape victims feel someone raped seen posts	?
423979576671232000	good know congressional candidate dick black doesn problem spousal rape _url_ via	?
423991157153349633	things likely happen falsely accused rape pandoradeloeste casey lawrence _url_	?
423998500347850752	oh thing nonviolent rape	?
424006062870921217	one feather delhi hat rape capital con rule now also becoming racist capital aap rule http	?
424010160131280896	kereke rape case deferred _url_ _url_	?
424017959959285760	somnath bharti can disclose rape victims name not nirbhaya rapist mohamad afroze quitaap	?
424018389896798208	delhi rape uk revises india travel advisory hindustan times _url_ uk travel	?
424020956504662017	come always last know latest juicy syracuse topics like rape	?
424022613778632704	rt convenient saudi men agree women cause sexual assault women liberty alliance _url_ via	?
424026950341238784	opinion rape jokes think can ever funny appropriate	?
424027696495362048	will kejriwal danish woman rape delkhi cartoon _url_	?
424031810402525184	rape tub _url_	?
424040586417422337	yay park chanyeol can semi rape jongin intro dubstep	?
424043136885587968	rt congbjpquitindia anti congress wave started anna movement delhi rape protest various scams exposed rti	?
424043638260121600	rt love rape children men women	?
424046764304633856	rape periods abuses abortion pregnancy harassment breast cancer walked cheated female	?
424060905970999296	whiteppl using dog get vine famous getting charged rape _url_ hahahhahahahahahahhaha	?
424067671705931777	ifwedate ll single af _url_ looks like girl tryna get rape	?
424078944799703040	rt man probably believes pay rape woman donate charity rape awesome http	?
424082617172897793	rt bizarre india introduces first handgun women named rape victim _url_ expensive	?
424085931692683264	know rape game like sex offender	?
424094072194600961	fake sexual assault case sant shri asaram bapuji preplanned paidmedia government knowthetruth _url_	?
424124550788706304	alleged rape victim cross examined	?
424163132714807296	rt britain france warn rape threat india _url_	?
424189255909654528	statutory rape _url_	?
424205284521693184	interactive violence women mexico _url_ feminicidios asesinadas justicia narcotr fico	?
424209515685617664	rt response day fuck sake dad didn rape kids paddy coombs	?
424223106270773248	activist post yet another woman sues tsa sexual assault _url_	?
424223250638336000	interactive violence women mexico _url_ feminicidios asesinadas justicia narc	?
424239012388564992	rt officer d like report crime see white girl literally dead attacked puppies omg help	?
424243610377125888	police three arrests india gang rape case six now accused attacking danish tourist new delhi _url_	?
424246753291165696	mom just called tell hi don drugs don go parties don sex white girls due date rape accusations	?
424249859667791872	reason online shopping gives better prices rape shipping fees	?
424249991998480384	temasperfectos rape nirvana	?
424254102101843968	rt dear aap arvind kejriwal rapes originate drugs prostitution amsterdam rape capital	?
424256520772419584	look cases messed stuff rape murder avg	?
424262113990017024	rt party found people fuck bed kicked dude fucked girl oleswitcharoo purdue	?
424288308126941186	house republicans pushing bill force irs audit rape victims thinkprogress _url_	?
424291935499866113	poor harry dragged kayla ayesha gossip girl convo	?
424318834560864256	female getting fingered beach hope get kicked twat every finger fuckin nasty	?
424335834679369728	_url_ girl	?
424345487001403393	rt papua new guinea violence can seem like norm women _url_	?
424366102148562944	can protect rohingya women girls persecution genocide rape murder burma	?
424374483449675776	nowplaying video helping sex trafficking victims _url_ _url_ socialmedia	?
424377006289997824	love bathroom singer bath tub please wait later will rape die max	?
424382223702560768	ok well next time maybe daddy won rape someone really think twice next time oh can	?
424391200586878977	rape whistle ve blown rn father watching candles	?
424394479248736257	ret army major slams upcoming camp ray movie kstew character befriends detainee also torture sexual assault _url_	?
424407552961425408	saw little girl selling girl scout cookies d rape twistin nipples	?
424421205446123520	quotes said sexual assault survivors family members _url_ via	?
424421468169330688	rt writer outs woman kills writes puzzled eulogy sickening violence obliviousness _url_	?
424425826218967040	former veterans administration police chief pleads guilty plot kidnap rape murder _url_	?
424428018618998784	word rape illegal woman say just use get away anything real horror days	?
424466296533942273	exactly will never darken doorstep church pastor arrested girl rape	?
424471202057715712	legalized rape child brides not just among poor also much greater problem _url_	?
424508298340335616	hear hope part reason tough sentencing try force give rape pals although like	?
424538087092666368	rt spousal abuse military sexual assault abortion republicans stand rapists rights democrats standwithwomen wher	?
424540632221515776	reports ex saint darren sharper arrested rape charges _url_ new orleans _url_ say ain	?
424546306678616064	welp breaking ex saint darren sharper arrested rape charges _url_	?
424565560572383233	former nfl player current nfl network analyst darren sharper arrested suspicion rape _url_	?
424568254762598401	china rape rapeculture india chinese mouth peace global times democracy tradition thwart law india _url_	?
424574520339361793	former nfl db darren sharper arrested rape roger goodell responded fining james harrison	?
424579462513295360	curtis lepore jessi smiles see vines made alleged rape read _url_ via hollywoodlife	?
424580609139163136	wow aw damn breaking ex saint darren sharper arrested rape charges _url_	?
424583641566814209	acc turkish court attacking woman tearing apart clothes groping breasts shows no sexual intention radi	?
424585012017889280	awful stat frm laura bates tedxeastend women planet will raped beaten life	?
424589138877116416	ever heard anyone spending months jail charged sexual assault forged one knowthetruth together rise justice	?
424589922272813056	warnings violence sexual violence non con blood threat cannibalism	?
424592917299470336	no need rape not cool enough earn needa kill	?
424602289094279168	ok rape	?
424605662417395713	latest update sb two kids jumped floor now sportin black eye sexual assault case morn	?
424609519818121216	sex without consent rape _url_ _url_	?
424619127127302144	former nfl safety darren sharper arrested yesterday los angeles suspicion rape alot nfl news	?
424633035972034560	oh must say aahh attempt rape o_o j_marselle see cont _url_	?
424637308571115520	know one accused rape kicked college football yet case dismissed woman proven liar	?
424641804307550209	think darren sharper guilty rape many women accused rape	?
424643704649838592	rt former nfl star faces rape charges police say _url_ _url_	?
424649113745891328	darren sharper charged rape hardest hittin saftey league doe	?
424650941019607040	ex nfl star faces rape allegations former nfl star darren sharper faces two rape charges los angeles poli _url_	?
424668100399603712	darren sharper arrested allegations sexual assault oneofthemosthardesthittingsafetiesintheleague	?
424670566335787008	meaning people myredbook private molester forums rape women forums probably created escortguide	?
424676619056599040	rights group myanmar military uses rape weapon war _url_	?
424677544647204864	lml aint gon like gon like ill get girl beat fuck aint nothin	?
424690103554805760	happens want rape	?
424692970911039488	lattoorepublic former nfl star darren sharper arrested two rape charges tmz _url_ theirfanism	?
424695584633937920	rape mean strangers benefits	?
424699734146969600	frighteningly accurate tw assault rape things society will try teach year old daughter _url_	?
424710467668307968	rape strong word prefer snuggle struggle	?
424713710188240896	omg amount sex rape scenes movie unreal good luck	?
424718634955845632	rape first sight mimguez	?
424729519787089920	fact people make anti rape clothes women not get raped shows fucked society	?
424735427270963200	urge us congress pass international violence women act now rise justice end global vaw	?
424754329304592384	rt _url_ rape whistle yeah ve got loud one tcot ccot cwot standyourground gunrights _url_	?
424759642179530752	rt rape dumbest crime ever rape innocent person hoes throwing pussy around	?
424765439189594112	rt rape dumbest crime ever rape innocent person hoes throwing pussy around	?
424785492501348353	rape nation	?
424787823150252032	rt professional fan girl just got kicked professional buuuurrrrrnnnn	?
424801323897204736	uh oh uh oh red alert tentacle rape imminent swordartonline toonami	?
424802848191172610	rt tyleroakleyjustgotslayed professional fan girl just got professionally kicked fandom liam	?
424827219270467584	rape	?
424858832381034497	darren sharper ex nfl star arrested rape charges _url_ news _url_	?
424863058822184960	thank m glad not just fuming stalling rape storyline actual eff	?
424887523564085248	rape isnt cool weather boy girl leave scar iam	?
424901441615327232	ll rape chris brown	?
424902496989876224	rt child divorced parents ve learn treat marriage love not fear david dennis _url_	?
424930958530191362	jessi smiles receiving death threats curtis lepore rape accusation _url_	?
424946635190587392	texas state troopers finger rape women side road beware	?
424949590345793536	rat news online girl raped five men walk home police essex start rape investigat _url_ rats fancyrats	?
424951542329122817	no bbc interactive guide sir jimmy savile rape sexual abuse children bbc premises	?
424968497534230528	girl raped five men walk home police essex start rape investigation teenage girl rep	?
424971376697430016	original green green attack rape ethniccleansing religionofpeace kpexodus kpholocaustday hdl _url_	?
424978825449971712	ask religion treated rape ethniccleansing religionofpeace kpexodus kpholocaustday hdl http	?
424980419193237504	go rape another nonno little creep	?
424990141409918976	just see omegle trying pull rape face	?
425028800779284480	seahawks better rape ers	?
425034081013727233	rt party found people fuck bed kicked dude fucked girl oleswitcharoo purdue	?
425059614963810304	essex rape year old attacked five men _url_	?
425060757450272768	kiki needs go away stop trying rape thanks	?
425069195198349312	came across message board supposedly didn censor tentacle rape scene sword art online	?
425079755084668928	damn right shit rape bank account gone sink even	?
425099223713869824	lazy website management yes m sorry rape thing doesn hold water sounds like sotry pile	?
425113013134589952	came behind like rape	?
425122107790733313	rt guess domestic violence actually isn joke along rape animal abuse degrading women bye	?
425128902814887936	photo no reason rape woman unless want fuck won let _url_	?
425131043126272000	kind fuckig bitch slut decided make thinner fucking whore will find rape fucker http	?
425137889589358592	hr severely restrict abortion force rape victims report assault irs fem prochoice _url_	?
425139501355130880	girl leave drama facebook twitter don got time cousin jaunito beat someone harkins	?
425158681433350144	rt rape police claims probe investigation still nothing done kejriwa	?
425159159948902401	cousin girl stalking went house everything called said gang m bringing crew	?
425161695418257409	rt instead apologising african women groping labelling prostitutes making urinate public re	?
425176821068349441	letter ugandan mission sex trafficking proves case arvind kejriwal _url_	?
425191715285127168	women oriented acts enacted govt protection women domestic violence act prohibition child marriage act inc women	?
425192299002601472	new jersey cracks sex trafficking ahead superbowl _url_ vaw fem	?
425194140955983872	wants rape children	?
425247909060571136	rt california gang rape vine video goes viral th vine graphic _url_	?
425254650355261440	teenage girl kicked floor riverside attempted robbery norwich teenage girl kicked _url_ norfolk	?
425265925525229568	ye ser ki rape oo tention hai	?
425275004188512256	rt kaur rape capital delhi due shinde delhi police krantikariaapgovt	?
425307887544844289	gonna rape ya now	?
425309947086532608	balada com ear rape de sangrar intestino	?
425324122097582080	many ppe graduates cowering foreign embassy trying avoid facing rape charges compared self styled freedomwankers	?
425325191263043584	jeje rape back ll help massage	?
425338183816314880	rt south african react aggressively real issues like rape corruption etc bafana	?
425340300752478209	men hearts began burn women not sex objects friends dignity	?
425359393861808129	rt california gang rape vine video goes viral th vine graphic _url_	?
425359411025309696	rt california gang rape vine video goes viral th vine graphic _url_	?
425359565127827456	rt california gang rape vine video goes viral th vine graphic _url_	?
425373334717464576	shinhye tie will rape	?
425377689563045888	rape africans aren angry people not culture nelsonmandelavibes	?
425383752668553216	rt essex police investigate terrifying gang rape year old girl _url_ lbcnews	?
425385440657821697	will not let topshop rape account will not let topshop rape account will not let topshop rape account	?
425387470922870786	rt year old woman beaten death front crosby santa ana ca jan th _url_	?
425391158165262337	vnaturr_ m not saying girls fault m just saying not case rape	?
425400084776243200	arrested alleged rape ucsb student isla vista santabarbara _url_	?
425426562255577088	look please don sad sorry ill let rape just please don sad	?
425434476798554112	davison two guest lectures university week mostly male students gang rape	?
425437912713277442	rape _url_	?
425439907293589505	worth read forgave rape _url_ _url_	?
425443813549932544	mummy biggest debate car jred kml stupid people think girls can rape boys	?
425446987173859329	rich looks like ready rape erica ass lls	?
425453001117937664	isn girl beat callie thefosters	?
425453321634459648	girl beat callie juvie group home shit	?
425460316408147968	gon rape now aint got no man	?
425470119666806784	krantikariaapgovt drama media make panel discussions post rape also trp drama	?
425474866553176064	snip zxx dream colored boys can rape white women not judged colo	?
425479640845930496	ariana new album going brutally rape everyone ears	?
425479845121101824	will pay college football team gang rape ya ass	?
425480608911859712	call rape get guy hanged	?
425481869149229056	smh rape segment news sad	?
425493159817142272	police comes delhi govt rape stop police mamta akhlesh doesn control crime just	?
425495783698608129	met laundry room asked date tried rape shitemilysays freshmanyearmemories	?
425496755451351040	demain soir je te met une rape gros	?
425501759076052993	almost beat girl not getting dance	?
425504252459745280	rt raped men woman looks help runs men also rape recovery op botched htt	?
425512485748490240	folks need book tell not rape doesn consistently atheism	?
425513413381341184	girl beat juvy gave look callie run now	?
425519973906132992	need make nd season orange new black hella wanna see happened girl getting beat hahah	?
425552062969954304	rt rape year not single suspension window mirror hm broke police men got suspended krantikariaapgovt	?
425590069613703168	chanyeol rape face _url_	?
425595790845685760	chanyeol rape face _url_	?
425606720987987968	rt important data collection sexual abuse violence india made available web _url_	?
425611627128291328	disturbing forced marriage alive well us via _url_	?
425612028678373376	corruption rape not anarchy aapdrama considered wrong india	?
425623922365956096	rt raped men woman looks help runs men also rape recovery op botched htt	?
425627704755372033	kejriwal just condemn rape incidents move cause like politicians represent ou	?
425630385662205952	no one real say pay rape go cops kick ass	?
425630852886720513	u touching yeol hehee chanyeol rape face _url_	?
425650854390030336	root human trafficking low self esteem women used ever	?
425665795448778752	rt party found people fuck bed kicked dude fucked girl oleswitcharoo purdue	?
425673332168884224	rt women like lit candles pretty look don respect will burn house	?
425700327187165184	la developed guidance responders use preventing sexual violence following disaster _url_	?
425717210871779328	don rape	?
425721239949565952	m stronger ve beaten torn apart thanks ve become strong independent woman today	?
425724460352565248	really lose lose situation get ya shit fucked woman call police pussy beat pussy	?
425731646684667904	oh la la can wait m gonna rape don want	?
425734679178657792	wed mother widowed child bride tells tale _url_ perverted tcot marriage ccot	?
425745845628051456	honestly just believed quinn deserved guy wasn womanizer didn rape say didn care beth	?
425751558803189762	tenia una melrnaza guapisima luego rape xdd	?
425766261541175296	choices syrian regime prison death continued destruction rape murder syria delay	?
425772047566766080	logic men shouldn save get hair cuts shouldn wear polyester rape okay	?
425783108412006401	rt rape culture telling daughters not get raped instead teaching sons treat women	?
425783643378696192	till death us part forgotten us victims forced marriage via _url_	?
425788158685741056	rape nah _url_	?
425791865070579712	rape nah _url_	?
425791897433419776	rape nah _url_	?
425796740890255361	going rape straw	?
425816308572114944	word prolly something rick ross alleged rape outline song shots fired	?
425823558019719168	niggas wear kobe can evade rape charge	?
425834476590362624	rape	?
425837342528917504	kid lhs probably mrs martinez period went tried rape someone	?
425844089200734208	rt someone ever tried rape daughter jump window electrocute	?
425845594897133568	rt not rape struggle snuggle	?
425851116346019841	rt somnath bharti led people attacked says ugandan woman _url_ _url_	?
425862752716873728	god plan not include forcing someone get pregnant rape nobody deserves	?
425879871714103296	rt can anything shinde fir good rape women free drug sex racketiers chalao danda	?
425881769594716160	rape	?
425938358569684992	cusu cusuwomen women rape not want julian assange extradite	?
425953817893830656	useless invalid real niggas rape sisters	?
425968863348400128	attacked mob led somnath bharti ugandan woman _url_	?
425969345731104768	app haqooq child marriage restraint act mutabiq saal say kaam umar larkion ki shadi karna qanoonun jurm hai	?
425970691373301760	affi get di pussy mi nah rape	?
425998081104965632	female asylum seeker alleges sexual assault another christmas island detainee _url_	?
426003014550560768	mi da igual que se rape	?
426009369881640960	et voil que rape d s que ai le dos tourn	?
426011289958105088	can never tolerate rape cases especially involves underage victims	?
426038563793149952	unveil initiative combat sexual assault college campuses _url_	?
426057258196557824	can help police trace people may info alleged rape basildon ny day photos htt	?
426059158493089792	rt cbsradionews white house new initiative combat sexual assault college campuses listen _url_	?
426065489425485824	not rape lightskin foo	?
426069950957359104	rt obama young woman drops school attacked not just terrible loss loss	?
426071414290907136	now watching president obama biden talking sexual assault _url_	?
426071478778355713	obama targets sexual assault problem _url_ via	?
426071906790285312	rt obama today ll sign presidential memorandum creating task force protect students sexual assault	?
426072096851390464	ve never heard president speak like sexual assault especially men hoping start talk becoming normal	?
426077904691146752	ever heard rebecca kiessling conceived rape man nate stand women _url_	?
426105859954212867	rt don understand rape brothel re nice	?
426107094215839744	tells goes jail like crucial things happen like boys jail rape	?
426107768475766784	just hearing rape makes angry	?
426107942023462912	rape actually lowest lows know stupid hoes decide traumatise someone	?
426110888635269120	obama targets college sexual assault epidemic affront basic decency _url_ _url_	?
426116461317586944	rape accounts less abortions excuse	?
426128107829862400	obama establishes task force sexual assault says father teach sons respect women _url_ tcot	?
426133615207284736	rt jesus irs start auditing rape victims want abortions just like rep trent franks wants	?
426135217468743681	morocco amends controversial rape law _url_	?
426139278499131392	underage sex trafficking ring targets runaways barba better ask right questions jerseybreakdown _url_	?
426143363424059392	really ur selling shoes real rape ur knocking boy huh smh wild	?
426144812501188608	girl beaten man finds explicit photos phone deputy says _url_	?
426146745178144768	stalkers rape	?
426160071265906688	rt rape culture portraying sexually active yr olds talk shows sluts instead wondering fuck sex wit	?
426166410860298240	got no game might well buy white econoline van live reputation pedophile hahaha id rather rape prostitute tbh	?
426178454795845632	sharia action dubai rape victim faces jail sex outside marriage _url_	?
426193616588263424	not rape enjoy	?
426196433398538240	one day children will leave nest kids life marriage will empty worthless o kids	?
426199110685691904	trafficknomore crazy take local sex trafficking informative fox	?
426201437400731649	can not rape thanks	?
426238615841013760	wb gang rape orders kangaroo court shocking self proclaimed courts dangerous khaps aap somnath bharti	?
426244346099167232	wtf indian village council orders gang rape woman punishment police _url_	?
426245153511051265	widespread violence women problem somalia new thematic briefing show six pages http	?
426250510090268672	will say anything rape orders west bengal	?
426266753736671232	mean say rape rarely mean rapists fulfill sexual needs just humiliation control ugh	?
426286127038087168	rt skull tattoo man wanted police rape girl _url_ _url_	?
426289816972824576	birmingham rape jihad police release cctv man sex attack boy _url_	?
426298305153220608	indian village council orders gang rape woman punishment alleged affair _url_	?
426332167027687424	horror otherness rape focus extreme case contributing refusal look within	?
426339947214151680	india woman raped court order police west bengal arrest men gang rape woman	?
426340826688389121	naxalites mt panchayat wb sentenced woman gang rape women rights cant left community mohalla durbar	?
426354191141842945	help rw di makan om limit gk rw rape no	?
426356333752102912	seemz just wants tips rape men	?
426363204948606978	eh marky mark arrested multiple times rob lowe sexual assault charge chris brown always come back	?
426369072855400448	women trafficking nigeria demand investigation _url_	?
426371217386242048	village court orders men gang rape indian woman judges _url_	?
426391524272652289	video woman guilty friend acid attack woman found guilty throwing acid face friend wh _url_	?
426396607006117888	cops searching suspect attempted east harlem rape new york pix wpix tv _url_	?
426398942587527168	mon man uhoes seen dat nigga justin bieber jail d make em bitch rape lil pretty ass no homo nothing doe	?
426401454854008832	m praying gang rape hope split little nonce	?
426401779870601216	rt rape meeee rape friend rape meeee rape agaaaain	?
426403304550051841	fucking selena not rape pure pleasure	?
426405647450517505	shame justin bed will occupied muscular criminals like rape little boys	?
426407723144454144	word rape matters discussion now one ontario today _url_	?
426418025852461058	another brutal rape india men victim tied tree ordered village leaders	?
426419783027150848	gonna rape mute block unfollow button today	?
426429074840764416	hate domestic violence class makes wanna beat shit woman ok packy	?
426430386517065728	thepeoplesvoice tv birth new earth rev kevin annett discusses vatican crimes child rape _url_	?
426433176337387520	rape justifiable say big no rape can never justifiable fightrapethursday	?
426434688085807104	rape much rape wowe _url_	?
426435894745108480	m sorry ve volunteered shelter battered women rape victims nothing funny	?
426436144767565824	well bieber jail now just need bubba rape murder like show oz	?
426436230537281536	indian woman senteced gang rape affair _url_	?
426449301716230144	controversial morocco rape law axed excellent news _url_	?
426461465663774726	quote day abortion doesn un rape woman _url_ via	?
426467484447686656	really someone actually said abortion doesn un rape woman _url_	?
426468074091741184	murder rape order way don struggle	?
426468326886617089	rape culture india	?
426474011586228224	right ok justin bieber said rape happens reason completely thrashed skydiving centre let free	?
426474942444494848	rt us ensure victims sexual violence not left face trials alone president obama http	?
426477113114251264	video woman guilty friend acid attack woman found guilty throwing acid face frie	?
426484256320552961	cam sit corner pretend nothing wrong can speak evil murder rape wrong	?
426490807768862720	horror news india local council order gang rape woman shared love man another religion _url_	?
